"Male Infertility with Large-Headed, Multiflagellar, Polyploid Spermatozoa",MESH:C562903,OMIM:243060,,MESH:D007248,C12.294.365.700/C562903,C12.294.365.700,"Infertility Associated with Multi-Tailed Spermatozoa and Excessive DNA|INFERTILITY ASSOCIATED WITH MULTITAILED SPERMATOZOA AND EXCESSIVE DNA|MALE INFERTILITY WITH LARGE-HEADED, MULTIFLAGELLAR, POLYPLOID SPERMATOZOA|SPERMATOGENIC FAILURE 5|SPGF5",Urogenital disease (male)
"Deafness, Autosomal Dominant 47",MESH:C563885,OMIM:608652,,MESH:D006319,C09.218.458.341.887/C563885|C10.597.751.418.341.887/C563885|C23.888.592.763.393.341.887/C563885,C09.218.458.341.887|C10.597.751.418.341.887|C23.888.592.763.393.341.887,DFNA47,Ear-nose-throat disease|Nervous system disease|Signs and symptoms
"Mental Retardation, X-Linked 52",MESH:C564502,OMIM:300504,,MESH:D038901,C10.597.606.643.455/C564502|C16.320.322.500/C564502|C16.320.400.525/C564502,C10.597.606.643.455|C16.320.322.500|C16.320.400.525,MRX52,Genetic disease (inborn)|Nervous system disease
Iatrogenic Disease,MESH:D007049,,"Any adverse condition in a patient occurring as the result of treatment by a physician, surgeon, or other health professional, especially infections acquired by a patient during the course of treatment.",MESH:D020969,C23.550.291.875,C23.550.291,"Condition, Hospital-Acquired|Conditions, Hospital-Acquired|Disease, Iatrogenic|Diseases, Iatrogenic|Hospital Acquired Condition|Hospital-Acquired Condition|Hospital-Acquired Conditions|Iatrogenic Diseases",Pathology (process)
"Deafness, Sensorineural, with Hypertrophic Cardiomyopathy",MESH:C565236,,,MESH:D002312|MESH:D006319,C09.218.458.341.887/C565236|C10.597.751.418.341.887/C565236|C14.280.238.100/C565236|C14.280.484.150.070.160/C565236|C23.888.592.763.393.341.887/C565236,C09.218.458.341.887|C10.597.751.418.341.887|C14.280.238.100|C14.280.484.150.070.160|C23.888.592.763.393.341.887,,Cardiovascular disease|Ear-nose-throat disease|Nervous system disease|Signs and symptoms
Airway Remodeling,MESH:D056151,,"The structural changes in the number, mass, size and/or composition of the airway tissues.",MESH:D020763,C23.300.017,C23.300,"Airway Remodeling, Asthmatic|Airway Remodelings|Airway Remodelings, Asthmatic|Airway Remodeling, Small|Airway Remodelings, Small|Airway Remodelling|Airway Remodelling, Asthmatic|Airway Remodellings|Airway Remodellings, Asthmatic|Airway Remodelling, Small|Airway Remodellings, Small|Airway Wall Remodelling|Airway Wall Remodellings|Asthmatic Airway Remodeling|Asthmatic Airway Remodelings|Asthmatic Airway Remodelling|Asthmatic Airway Remodellings|Asthmatic Airway Wall Remodeling|Asthmatic Airway Wall Remodelling|Remodeling, Airway|Remodeling, Asthmatic Airway|Remodelings, Airway|Remodelings, Asthmatic Airway|Remodeling, Small Airway|Remodelings, Small Airway|Remodelling, Airway|Remodelling, Airway Wall|Remodelling, Asthmatic Airway|Remodellings, Airway|Remodellings, Airway Wall|Remodellings, Asthmatic Airway|Remodelling, Small Airway|Remodellings, Small Airway|Small Airway Remodeling|Small Airway Remodelings|Small Airway Remodelling|Small Airway Remodellings|Wall Remodelling, Airway|Wall Remodellings, Airway",Pathology (anatomical condition)
Choroid plexus calcification with mental retardation,MESH:C535357,,,MESH:D002114|MESH:D008607,C10.597.606.643/C535357|C18.452.174.130/C535357|C23.888.592.604.646/C535357|F03.625.539/C535357,C10.597.606.643|C18.452.174.130|C23.888.592.604.646|F03.625.539,Choroido-cerebral calcification syndrome with retardation|Choroid Plexus Calcification and Mental Retardation,Mental disorder|Metabolic disease|Nervous system disease|Signs and symptoms
Ramon Syndrome,MESH:C535285,,,MESH:D002636|MESH:D004827|MESH:D005351|MESH:D006130|MESH:D006983|MESH:D008607,C05.116.099.708.375.199/C535285|C05.500.174/C535285|C07.320.173/C535285|C07.465.525.304/C535285|C07.465.714.258.428.200/C535285|C07.650.525.304/C535285|C10.228.140.490/C535285|C10.597.606.643/C535285|C16.131.621.207.540.170/C535285|C16.131.850.525.304/C535285|C16.320.170/C535285|C17.800.329.875/C535285|C23.550.393/C535285|C23.888.592.604.646/C535285|F03.625.539/C535285,C05.116.099.708.375.199|C05.500.174|C07.320.173|C07.465.525.304|C07.465.714.258.428.200|C07.650.525.304|C10.228.140.490|C10.597.606.643|C16.131.621.207.540.170|C16.131.850.525.304|C16.320.170|C17.800.329.875|C23.550.393|C23.888.592.604.646|F03.625.539,Gingival fibromatosis combined with cherubism,Congenital abnormality|Genetic disease (inborn)|Mental disorder|Mouth disease|Musculoskeletal disease|Nervous system disease|Pathology (process)|Signs and symptoms|Skin disease
"Conjunctivitis, Viral",MESH:D003236,,"Inflammation, often mild, of the conjunctiva caused by a variety of viral agents. Conjunctival involvement may be part of a systemic infection.",MESH:D003231|MESH:D015828,C02.325.250|C11.187.183.240|C11.294.800.250,C02.325|C11.187.183|C11.294.800,"Conjunctivitides, Viral|Viral Conjunctivitides|Viral Conjunctivitis",Eye disease|Viral disease
Moyamoya disease 3,MESH:C536993,OMIM:608796,,MESH:D009072,C10.228.140.300.200.600/C536993|C10.228.140.300.510.200.737/C536993|C14.907.137.615/C536993|C14.907.253.123.620/C536993|C14.907.253.560.200.737/C536993,C10.228.140.300.200.600|C10.228.140.300.510.200.737|C14.907.137.615|C14.907.253.123.620|C14.907.253.560.200.737,MYMY3,Cardiovascular disease|Nervous system disease
Anonychia-onychodystrophy with brachydactyly type B and ectrodactyly,MESH:C536379,,,MESH:D009264|MESH:D059327,C05.660.585.262/C536379|C16.131.621.585.262/C536379|C23.300.820/C536379,C05.660.585.262|C16.131.621.585.262|C23.300.820,Kumar Levick syndrome,Congenital abnormality|Musculoskeletal disease|Pathology (anatomical condition)
Esophageal and Gastric Varices,MESH:D004932,,"Dilated blood vessels in the ESOPHAGUS or GASTRIC FUNDUS that shunt blood from the portal circulation (PORTAL SYSTEM) to the systemic venous circulation. Often they are observed in individuals with portal hypertension (HYPERTENSION, PORTAL).",MESH:D004935|MESH:D006975,C06.405.117.240|C06.552.494.414,C06.405.117|C06.552.494,"Esophageal Varices|Esophageal Varix|Gastric Varices|Gastric Varix|Varices, Esophageal|Varices, Gastric|Varix, Esophageal|Varix, Gastric",Digestive system disease
"Cardiac Lipidosis, Familial",MESH:C565884,,,MESH:D008064|MESH:D009202,C14.280.238/C565884|C16.320.565.398.641/C565884|C18.452.584.687/C565884|C18.452.648.398.641/C565884,C14.280.238|C16.320.565.398.641|C18.452.584.687|C18.452.648.398.641,,Cardiovascular disease|Genetic disease (inborn)|Metabolic disease
"Cardiomyopathy, Dilated, 1C",MESH:C563307,OMIM:601493,,MESH:D002311,C14.280.195.160/C563307|C14.280.238.070/C563307,C14.280.195.160|C14.280.238.070,"CARDIOMYOPATHY, DILATED, 1C, WITH OR WITHOUT LEFT VENTRICULAR NONCOMPACTION|CARDIOMYOPATHY, FAMILIAL HYPERTROPHIC, 24, INCLUDED|CMD1C|CMH24, INCLUDED|LEFT VENTRICULAR NONCOMPACTION 3, INCLUDED|LVNC3, INCLUDED",Cardiovascular disease
"Nose Deformities, Acquired",MESH:D009667,,Abnormalities of the nose acquired after birth from injury or disease.,MESH:D009668,C08.460.619|C09.603.619,C08.460|C09.603,"Acquired Nasal Deformities|Acquired Nasal Deformity|Acquired Nose Deformities|Acquired Nose Deformity|Nasal Deformities, Acquired|Nasal Deformity, Acquired|Nose Deformity, Acquired",Ear-nose-throat disease|Respiratory tract disease
Noonan syndrome 3,MESH:C537847,OMIM:609942,,MESH:D009634,C05.660.207.690/C537847|C14.240.400.787/C537847|C14.280.400.787/C537847|C16.131.240.400.784/C537847|C16.131.621.207.690/C537847|C17.300.690/C537847,C05.660.207.690|C14.240.400.787|C14.280.400.787|C16.131.240.400.784|C16.131.621.207.690|C17.300.690,NS3,Cardiovascular disease|Congenital abnormality|Connective tissue disease|Musculoskeletal disease
Corneal Endothelial Cell Loss,MESH:D055954,,"Loss of CORNEAL ENDOTHELIUM usually following intraocular surgery (e.g., cataract surgery) or due to FUCHS' ENDOTHELIAL DYSTROPHY; ANGLE-CLOSURE GLAUCOMA; IRITIS; or aging.",MESH:D003316|MESH:D011183,C11.204.278|C23.550.767.093,C11.204|C23.550.767,"Corneal Endothelial Cell Damage|Endothelial Cell Loss, Corneal",Eye disease|Pathology (process)
"GLAUCOMA 3, PRIMARY CONGENITAL, C",OMIM:613085,DO:DOID:0050593,,MESH:D005901,C11.525.381/613085,C11.525.381,GLC3C,Eye disease
Microcephaly nonsyndromal,MESH:C537542,,,MESH:D008831,C05.660.207.620/C537542|C10.500.507.400.500/C537542|C16.131.621.207.620/C537542|C16.131.666.507.400.500/C537542,C05.660.207.620|C10.500.507.400.500|C16.131.621.207.620|C16.131.666.507.400.500,Nonsyndromal microcephaly|Nonsyndromic microcephaly,Congenital abnormality|Musculoskeletal disease|Nervous system disease
Hypertrichosis congenital generalized X-linked,MESH:C538388,OMIM:307150,,MESH:D006983|MESH:D040181,C16.320.322/C538388|C17.800.329.875/C538388,C16.320.322|C17.800.329.875,"CGH|CHROMOSOME Xq27.1 INTERCHROMOSOMAL INSERTION SYNDROME|HCG|HTC2|Hypertrichosis, Congenital Generalized|Macias-Flores Garcia-Cruz Rivera syndrome",Genetic disease (inborn)|Skin disease
"EPILEPTIC ENCEPHALOPATHY, EARLY INFANTILE, 52",OMIM:617350,,,MESH:D013036,C10.228.140.490.375.760/617350|C10.228.140.490.493.875/617350,C10.228.140.490.375.760|C10.228.140.490.493.875,EIEE52,Nervous system disease
Brain Diseases,MESH:D001927,DO:DOID:936,"Pathologic conditions affecting the BRAIN, which is composed of the intracranial components of the CENTRAL NERVOUS SYSTEM. This includes (but is not limited to) the CEREBRAL CORTEX; intracranial white matter; BASAL GANGLIA; THALAMUS; HYPOTHALAMUS; BRAIN STEM; and CEREBELLUM.",MESH:D002493,C10.228.140,C10.228,"Brain Disease|Brain Disorder|Brain Disorders|Central Nervous System Disorders, Intracranial|Central Nervous System Intracranial Disorders|CNS Disorder, Intracranial|CNS Disorders, Intracranial|Encephalon Disease|Encephalon Diseases|Encephalopathies|Encephalopathy|Intracranial Central Nervous System Disorders|Intracranial CNS Disorder|Intracranial CNS Disorders",Nervous system disease
"Chromosome 1q, duplication 1q12 q21",MESH:C538312,,,MESH:D014314,C23.550.210.050.750/C538312|C23.550.210.182.500/C538312,C23.550.210.050.750|C23.550.210.182.500,Duplication 1q12 q21,Pathology (process)
Acheiropodia,MESH:C536014,OMIM:200500,,MESH:D005532|MESH:D006228,C05.330.495/C536014|C05.390.408/C536014|C05.660.585.512.380/C536014|C05.660.585.988.425/C536014|C16.131.621.585.512.500/C536014|C16.131.621.585.988.500/C536014,C05.330.495|C05.390.408|C05.660.585.512.380|C05.660.585.988.425|C16.131.621.585.512.500|C16.131.621.585.988.500,"ACHEIROPODIA|Acheiropody|Acheiropody, Brazilian type|ACHP|Brazilian type acheiropody",Congenital abnormality|Musculoskeletal disease
"Milia, Multiple Eruptive",MESH:C562823,,,MESH:D007642,C17.800.428/C562823,C17.800.428,Multiple eruptive milia,Skin disease
"Hemangioendothelioma, Epithelioid",MESH:D018323,,"A tumor of medium-to-large veins, composed of plump-to-spindled endothelial cells that bulge into vascular spaces in a tombstone-like fashion. These tumors are thought to have 'borderline' aggression, where one-third develop local recurrences, but only rarely metastasize. It is unclear whether the epithelioid hemangioendothelioma is truly neoplastic or an exuberant tissue reaction, nor is it clear if this is equivalent to Kimura's disease (see ANGIOLYMPHOID HYPERPLASIA WITH EOSINOPHILIA). (Segen, Dictionary of Modern Medicine, 1992)",MESH:D006390,C04.557.645.375.370.380,C04.557.645.375.370,"Epithelioid Hemangioendothelioma|Epithelioid Hemangioendotheliomas|Hemangioendotheliomas, Epithelioid",Cancer
OPTIC ATROPHY 2,OMIM:311050,DO:DOID:5723,,MESH:D015418,C10.292.700.225.500/311050|C10.574.500.662/311050|C11.270.564/311050|C11.640.451.451/311050|C16.320.290.564/311050|C16.320.400.630/311050,C10.292.700.225.500|C10.574.500.662|C11.270.564|C11.640.451.451|C16.320.290.564|C16.320.400.630,"OPA2|OPTIC ATROPHY, NON-LEBER TYPE, WITH EARLY ONSET|OPTIC ATROPHY, X-LINKED",Eye disease|Genetic disease (inborn)|Nervous system disease
Acanthamoeba Keratitis,MESH:D015823,,Infection of the cornea by an ameboid protozoan which may cause corneal ulceration leading to blindness.,MESH:D000562|MESH:D007634|MESH:D015822,C03.300.125|C03.752.049.203|C11.204.564.112|C11.294.725.125,C03.300|C03.752.049|C11.204.564|C11.294.725,"Acanthamoeba Keratitides|Keratitides, Acanthamoeba|Keratitis, Acanthamoeba",Eye disease|Parasitic disease
"GLAUCOMA 3, PRIMARY CONGENITAL, E",OMIM:617272,,,MESH:D005901,C11.525.381/617272,C11.525.381,GLC3E,Eye disease
"MICROPHTHALMIA, ISOLATED 6",OMIM:613517,DO:DOID:0060835,,MESH:D008850,C11.250.566/613517|C16.131.384.666/613517,C11.250.566|C16.131.384.666,"MCOP6|MICROPHTHALMIA, POSTERIOR NONSYNDROMIC",Congenital abnormality|Eye disease
Cakut,MESH:C566906,,,MESH:D014564|MESH:D014718,C12.706/C566906|C12.777.829.920/C566906|C13.351.875/C566906|C13.351.968.829.920/C566906|C16.131.939/C566906,C12.706|C12.777.829.920|C13.351.875|C13.351.968.829.920|C16.131.939,Congenital Anomalies Of Kidney And Urinary Tract,Congenital abnormality|Urogenital disease (female)|Urogenital disease (male)
"OSTEOGENESIS IMPERFECTA, TYPE XI",OMIM:610968,DO:DOID:0110351,,MESH:D010013,C05.116.099.708.685/610968|C16.320.737/610968|C17.300.200.540/610968,C05.116.099.708.685|C16.320.737|C17.300.200.540,"OI11|OI, TYPE XI",Connective tissue disease|Genetic disease (inborn)|Musculoskeletal disease
"Encephalitis, Tick-Borne",MESH:D004675,DO:DOID:0050175,"Encephalitis caused by neurotropic viruses that are transmitted via the bite of TICKS. In Europe, the diseases are caused by ENCEPHALITIS VIRUSES, TICK-BORNE, which give rise to Russian spring-summer encephalitis, central European encephalitis, louping ill encephalitis, and related disorders. Powassan encephalitis occurs in North America and Russia and is caused by the Powassan virus. ASEPTIC MENINGITIS and rarely encephalitis may complicate COLORADO TICK FEVER which is endemic to mountainous regions of the western United States. (From Joynt, Clinical Neurology, 1996, Ch26, pp14-5)",MESH:D004671|MESH:D017282|MESH:D018177,C02.081.343.360|C02.081.885.400|C02.182.525.300.350|C02.290.310.530|C02.782.310.360|C02.782.350.250.500|C10.228.140.430.520.750.300.775|C10.228.228.245.340.300.775|C10.228.228.399.750.300.775,C02.081.343|C02.081.885|C02.182.525.300|C02.290.310|C02.782.310|C02.782.350.250|C10.228.140.430.520.750.300|C10.228.228.245.340.300|C10.228.228.399.750.300,"Central European Encephalitis|Encephalitides, European Tick-Borne|Encephalitides, Louping Ill|Encephalitides, Powassan|Encephalitides, Tick-Borne|Encephalitis, Central European|Encephalitis, European Tick Borne|Encephalitis, European Tick-Borne|Encephalitis, Far Eastern Russian|Encephalitis, Louping Ill|Encephalitis, Powassan|Encephalitis, Russian Spring Summer|Encephalitis, Russian Spring-Summer|Encephalitis, Tick Borne|European Tick-Borne Encephalitides|European Tick Borne Encephalitis|European Tick-Borne Encephalitis|Far Eastern Russian Encephalitis|Louping Ill Encephalitides|Louping Ill Encephalitis|Powassan Encephalitides|Powassan Encephalitis|Russian Spring Summer Encephalitis|Russian Spring-Summer Encephalitis|Spring-Summer Encephalitis, Russian|Tick-Borne Encephalitides|Tick-Borne Encephalitides, European|Tick Borne Encephalitis|Tick-Borne Encephalitis|Tick-Borne Encephalitis, European",Nervous system disease|Viral disease
Chronic recurrent multifocal osteomyelitis,MESH:C535456,OMIM:259680,,MESH:D010019,C01.539.160.495/C535456|C05.116.165.495/C535456,C01.539.160.495|C05.116.165.495,"Chronic multifocal osteomyelitis|CMO|CRMO|Multifocal osteomyelitis, chronic|Osteomyelitis, Chronic Multifocal",Bacterial infection or mycosis|Musculoskeletal disease
"Nephropathy, Progressive Tubulointerstitial, with Cholestatic Liver Disease",MESH:C566573,,,MESH:D002780|MESH:D009395,C06.130.120.135.250/C566573|C06.552.150/C566573|C12.777.419.570.643/C566573|C13.351.968.419.570.643/C566573,C06.130.120.135.250|C06.552.150|C12.777.419.570.643|C13.351.968.419.570.643,,Digestive system disease|Urogenital disease (female)|Urogenital disease (male)
Double Nail for Fifth Toe,MESH:C565090,,,MESH:D009260|MESH:D009264,C17.800.529/C565090|C23.300.820/C565090,C17.800.529|C23.300.820,,Pathology (anatomical condition)|Skin disease
Alternating hemiplegia of childhood,MESH:C536589,OMIM:104290|OMIM:614820,,MESH:D006429,C10.597.622.295/C536589|C23.888.592.636.312/C536589,C10.597.622.295|C23.888.592.636.312,AHC1|AHC2|Alternating hemiplegia|ALTERNATING HEMIPLEGIA OF CHILDHOOD 1|ALTERNATING HEMIPLEGIA OF CHILDHOOD 2|Alternating hemiplegia syndrome,Nervous system disease|Signs and symptoms
Rozin Hertz Goodman syndrome,MESH:C535876,,,MESH:D000015|MESH:D003286|MESH:D005124|MESH:D006228|MESH:D019465,C05.390.408/C535876|C05.550.323/C535876|C05.651.197/C535876|C05.660.207/C535876|C05.660.585.988.425/C535876|C11.250/C535876|C16.131.077/C535876|C16.131.384/C535876|C16.131.621.207/C535876|C16.131.621.585.988.500/C535876,C05.390.408|C05.550.323|C05.651.197|C05.660.207|C05.660.585.988.425|C11.250|C16.131.077|C16.131.384|C16.131.621.207|C16.131.621.585.988.500,"Camptodactyly, joint contractures, facial skeletal defects|Camptodactyly, myopia, and fibrosis of the medial rectus muscle of eye",Congenital abnormality|Eye disease|Musculoskeletal disease
Holoprosencephaly 6,MESH:C565274,OMIM:605934,,MESH:D016142,C05.660.207.410/C565274|C10.500.034.875/C565274|C16.131.077.410/C565274|C16.131.260.380/C565274|C16.131.621.207.410/C565274|C16.131.666.034.875/C565274|C16.320.180.380/C565274,C05.660.207.410|C10.500.034.875|C16.131.077.410|C16.131.260.380|C16.131.621.207.410|C16.131.666.034.875|C16.320.180.380,HPE6,Congenital abnormality|Genetic disease (inborn)|Musculoskeletal disease|Nervous system disease
Foreign Bodies,MESH:D005547,,Inanimate objects that become enclosed in the body.,MESH:D014947,C26.392,C26,"Bodies, Foreign|Body, Foreign|Foreign Body|Foreign Object|Foreign Objects|Gossypiboma|Gossypibomas|Object, Foreign|Objects, Foreign|Retained Surgical Instrument|Retained Surgical Instruments|Retained Surgical Item|Retained Surgical Items|Retained Surgical Needle|Retained Surgical Needles|Retained Surgical Sponge|Retained Surgical Sponges|Retained Surgical Tool|Retained Surgical Tools|Surgical Instrument, Retained|Surgical Instruments, Retained|Surgical Item, Retained|Surgical Items, Retained|Surgical Needle, Retained|Surgical Needles, Retained|Surgical Sponge, Retained|Surgical Sponges, Retained|Surgical Tool, Retained|Surgical Tools, Retained|Textiloma|Textilomas",Wounds and injuries
Carnevale Hernandez Castillo syndrome,MESH:C535585,,,MESH:D006228,C05.390.408/C535585|C05.660.585.988.425/C535585|C16.131.621.585.988.500/C535585,C05.390.408|C05.660.585.988.425|C16.131.621.585.988.500,Triphalyngeal thumbs and brachyectrodactyly,Congenital abnormality|Musculoskeletal disease
Diastasis Recti And Weakness Of The Linea Alba,MESH:C567402,,,MESH:D011535,C16.131.077.745/C567402,C16.131.077.745,,Congenital abnormality
Colonic Pseudo-Obstruction,MESH:D003112,DO:DOID:3876,"Functional obstruction of the COLON leading to MEGACOLON in the absence of obvious COLONIC DISEASES or mechanical obstruction. When this condition is acquired, acute, and coexisting with another medical condition (trauma, surgery, serious injuries or illness, or medication), it is called Ogilvie's syndrome.",MESH:D003109|MESH:D007418,C06.405.469.158.272.217|C06.405.469.531.492.500.217,C06.405.469.158.272|C06.405.469.531.492.500,"Colonic Pseudoobstruction|Colonic Pseudo Obstruction|Ogilvie Disease|Ogilvie's Syndrome|Ogilvie Syndrome|Pseudoobstruction, Colonic|Pseudo-Obstruction, Colonic|Syndrome, Ogilvie",Digestive system disease
Mastoiditis,MESH:D008417,DO:DOID:0060322,Inflammation of the honeycomb-like MASTOID BONE in the skull just behind the ear. It is usually a complication of OTITIS MEDIA.,MESH:D010019|MESH:D010033,C01.539.160.495.500|C05.116.165.495.249|C09.218.705.663.652,C01.539.160.495|C05.116.165.495|C09.218.705.663,Mastoiditides,Bacterial infection or mycosis|Ear-nose-throat disease|Musculoskeletal disease
Radius absent anogenital anomalies,MESH:C535281,,,MESH:D001848|MESH:D006849|MESH:D007021|MESH:D040181,C05.116.099/C535281|C10.228.140.602/C535281|C12.294.494.400/C535281|C12.706.516/C535281|C13.351.875.466/C535281|C16.131.939.516/C535281|C16.320.322/C535281,C05.116.099|C10.228.140.602|C12.294.494.400|C12.706.516|C13.351.875.466|C16.131.939.516|C16.320.322,"Radial Aplasia And Anogenital Anomalies|Radial aplasia, X-linked",Congenital abnormality|Genetic disease (inborn)|Musculoskeletal disease|Nervous system disease|Urogenital disease (female)|Urogenital disease (male)
Deafness hyperuricemia neurologic ataxia,MESH:C535995,,,MESH:D001259|MESH:D003638|MESH:D008661,C09.218.458.341.186/C535995|C10.597.350.090/C535995|C10.597.751.418.341.186/C535995|C16.320.565/C535995|C18.452.648/C535995|C23.888.592.350.090/C535995|C23.888.592.763.393.341.186/C535995,C09.218.458.341.186|C10.597.350.090|C10.597.751.418.341.186|C16.320.565|C18.452.648|C23.888.592.350.090|C23.888.592.763.393.341.186,,Ear-nose-throat disease|Genetic disease (inborn)|Metabolic disease|Nervous system disease|Signs and symptoms
Hypercapnia,MESH:D006935,,A clinical manifestation of abnormal increase in the amount of carbon dioxide in arterial blood.,MESH:D012818,C23.888.852.544,C23.888.852,,Signs and symptoms
Cataract congenital Volkmann type,MESH:C538285,OMIM:115665,,MESH:D002386,C11.510.245/C538285,C11.510.245,"CATARACT 8, MULTIPLE TYPES|Cataract, Congenital, Volkmann Type|CCV|CTRCT8",Eye disease
Orofaciodigital syndrome type1,MESH:C537134,OMIM:311200,,MESH:D009958,C05.116.099.370.652/C537134|C05.660.207.700/C537134|C16.131.077.676/C537134|C16.131.260.830.670/C537134|C16.131.621.207.700/C537134|C16.320.180.830.670/C537134|C16.320.714/C537134,C05.116.099.370.652|C05.660.207.700|C16.131.077.676|C16.131.260.830.670|C16.131.621.207.700|C16.320.180.830.670|C16.320.714,"OFD1|OFDS I|Oral-facial-digital syndrome, type 1|ORAL-FACIAL-DIGITAL SYNDROME, TYPE I|OROFACIODIGITAL SYNDROME I|PAPILLON-LEAGE AND PSAUME SYNDROME|Papillon-League-Psaume syndrome",Congenital abnormality|Genetic disease (inborn)|Musculoskeletal disease
Chromosome 8 ring,MESH:C537824,,,MESH:D012303,C23.550.210.760/C537824,C23.550.210.760,Ring chromosome 8,Pathology (process)
Addison Disease,MESH:D000224,DO:DOID:13774,"An adrenal disease characterized by the progressive destruction of the ADRENAL CORTEX, resulting in insufficient production of ALDOSTERONE and HYDROCORTISONE. Clinical symptoms include ANOREXIA; NAUSEA; WEIGHT LOSS; MUSCLE WEAKNESS; and HYPERPIGMENTATION of the SKIN due to increase in circulating levels of ACTH precursor hormone which stimulates MELANOCYTES.",MESH:D000309|MESH:D001327,C19.053.500.263|C20.111.163,C19.053.500|C20.111,"Addison's Disease|Addisons Disease|Adrenal Insufficiency, Primary|Adrenocortical Insufficiencies, Primary|Adrenocortical Insufficiency, Primary|Disease, Addison|Hypoadrenalism, Primary|Hypoadrenalisms, Primary|Insufficiencies, Primary Adrenocortical|Insufficiency, Primary Adrenocortical|Primary Adrenal Insufficiency|Primary Adrenocortical Insufficiencies|Primary Adrenocortical Insufficiency|Primary Hypoadrenalism",Endocrine system disease|Immune system disease
Discrete Subaortic Stenosis,MESH:D021922,DO:DOID:5804,"A type of constriction that is caused by the presence of a fibrous ring (discrete type) below the AORTIC VALVE, anywhere between the aortic valve and the MITRAL VALVE. It is characterized by restricted outflow from the LEFT VENTRICLE into the AORTA.",MESH:D001020,C14.280.484.150.070.210|C14.280.955.249.070.210,C14.280.484.150.070|C14.280.955.249.070,"Discrete Subaortic Stenoses|Stenoses, Discrete Subaortic|Stenosis, Discrete Subaortic|Subaortic Stenoses, Discrete|Subaortic Stenosis, Discrete",Cardiovascular disease
"MICROVASCULAR COMPLICATIONS OF DIABETES, SUSCEPTIBILITY TO, 3",OMIM:612624,,,MESH:D003925,C14.907.320/612624|C19.246.099.500/612624,C14.907.320|C19.246.099.500,"END-STAGE RENAL DISEASE, DIABETIC, SUSCEPTIBILITY TO|MVCD3|NEPHROPATHY, DIABETIC, SUSCEPTIBILITY TO",Cardiovascular disease|Endocrine system disease
Atelosteogenesis type 2,MESH:C535395,OMIM:256050,,MESH:D010009,C05.116.099.708/C535395|C16.320.728/C535395,C05.116.099.708|C16.320.728,"AO2|AOII|Atelosteogenesis De La Chapelle Type|Atelosteogenesis, Type 2|Atelosteogenesis, Type II|De La Chapelle Dysplasia|DLCD, INCLUDED|McAlister Dysplasia|Neonatal osseous dysplasia 1|Neonatal Osseous Dysplasia I|NEONATAL OSSEOUS DYSPLASIA I  DE LA CHAPELLE DYSPLASIA, INCLUDED",Genetic disease (inborn)|Musculoskeletal disease
Drachtman Weinblatt Sitarz syndrome,MESH:C535603,,,MESH:D001855|MESH:D009421,C10.500/C535603|C15.378.190/C535603|C16.131.666/C535603,C10.500|C15.378.190|C16.131.666,Marrow hypoplasia associated with congenital neurologic anomalies,Blood disease|Congenital abnormality|Nervous system disease
"Rolandic Epilepsy, Mental Retardation, And Speech Dyspraxia, Autosomal Dominant",MESH:C563392,,,MESH:D001072|MESH:D008607|MESH:D019305,C10.228.140.490.360.280/C563392|C10.228.140.490.493.250/C563392|C10.597.606.643/C563392|C10.597.606.881.350/C563392|C23.888.592.604.646/C563392|C23.888.592.604.882.350/C563392|F03.625.539/C563392,C10.228.140.490.360.280|C10.228.140.490.493.250|C10.597.606.643|C10.597.606.881.350|C23.888.592.604.646|C23.888.592.604.882.350|F03.625.539,ADRESD|RESDAD,Mental disorder|Nervous system disease|Signs and symptoms
Deafness conductive ptosis skeletal anomalies,MESH:C535993,,,MESH:D001763|MESH:D001848|MESH:D006314,C05.116.099/C535993|C09.218.458.341.562/C535993|C10.597.751.418.341.562/C535993|C11.338.204/C535993|C23.888.592.763.393.341.562/C535993,C05.116.099|C09.218.458.341.562|C10.597.751.418.341.562|C11.338.204|C23.888.592.763.393.341.562,"Deafness, Conductive, with Ptosis and Skeletal Anomalies|Jackson Barr syndrome",Ear-nose-throat disease|Eye disease|Musculoskeletal disease|Nervous system disease|Signs and symptoms
